name,rating,date,title,colour,review_raw,review_norm,tokens,lemmas,tokens_str,lemmas_str,len_tokens
satish,2.0 out of 5 stars,5 November 2025,Long-Term Review (Using Since May 2023),BlueConfiguration: Echo Dot Only,"I’ve been using this device since May 2023, and honestly, from day one, I’ve felt disappointed with my purchase. There are a few ongoing issues that really need attention:1. Poor voice recognition: It doesn’t recognise words properly, especially Indian English. In reality, when we ask for Telugu or Tamil songs, it just doesn’t understand or play the correct ones.2. Frequent disconnection issues: Every 3–4 months, it disconnects on its own, and I have to reset it to make it work again. This time, it hasn’t connected for the last 10 days.3. Lack of helpful suggestions: Alexa should give regular suggestions through the mobile app or YouTube on how to make better use of it. Right now, we only use it for songs, reminders, time, and weather.4. Maintenance issue: My Echo is kept in the kitchen, and it has tiny holes that easily collect dust. I have no idea how to clean them safely.Overall, I feel quite disappointed that I bought this. I should have gone for a Google product instead — at least it understands Indian English and regional language names much better.",i ve been using this device since may 2023 and honestly from day one i ve felt disappointed with my purchase there are a few ongoing issues that really need attention 1 poor voice recognition it doesn t recognise words properly especially indian english in reality when we ask for telugu or tamil songs it just doesn t understand or play the correct ones 2 frequent disconnection issues every 3 4 months it disconnects on its own and i have to reset it to make it work again this time it hasn t connected for the last 10 days 3 lack of helpful suggestions alexa should give regular suggestions through the mobile app or youtube on how to make better use of it right now we only use it for songs reminders time and weather 4 maintenance issue my echo is kept in the kitchen and it has tiny holes that easily collect dust i have no idea how to clean them safely overall i feel quite disappointed that i bought this i should have gone for a google product instead at least it understands indian english and regional language names much better,"['ve', 'device', '2023', 'honestly', 'day', 've', 'felt', 'disappointed', 'purchase', 'ongoing', 'issues', 'need', 'attention', 'poor', 'voice', 'recognition', 'doesn', 't', 'recognise', 'words', 'properly', 'especially', 'indian', 'english', 'reality', 'ask', 'telugu', 'tamil', 'songs', 'doesn', 't', 'understand', 'play', 'correct', 'ones', 'frequent', 'disconnection', 'issues', 'months', 'disconnects', 'reset', 'work', 'time', 'hasn', 't', 'connected', '10', 'days', 'lack', 'helpful', 'suggestions', 'alexa', 'regular', 'suggestions', 'mobile', 'app', 'youtube', 'better', 'use', 'right', 'use', 'songs', 'reminders', 'time', 'weather', 'maintenance', 'issue', 'echo', 'kept', 'kitchen', 'tiny', 'holes', 'easily', 'collect', 'dust', 'idea', 'clean', 'safely', 'overall', 'feel', 'disappointed', 'bought', 'gone', 'google', 'product', 'instead', 'understands', 'indian', 'english', 'regional', 'language', 'names', 'better']","['ve', 'device', '2023', 'honestly', 'day', 've', 'feel', 'disappointed', 'purchase', 'ongoing', 'issue', 'need', 'attention', 'poor', 'voice', 'recognition', 'doesn', 't', 'recognise', 'word', 'properly', 'especially', 'indian', 'english', 'reality', 'ask', 'telugu', 'tamil', 'song', 'doesn', 't', 'understand', 'play', 'correct', 'one', 'frequent', 'disconnection', 'issue', 'month', 'disconnect', 'reset', 'work', 'time', 'hasn', 't', 'connect', '10', 'day', 'lack', 'helpful', 'suggestion', 'alexa', 'regular', 'suggestion', 'mobile', 'app', 'youtube', 'well', 'use', 'right', 'use', 'song', 'reminder', 'time', 'weather', 'maintenance', 'issue', 'echo', 'keep', 'kitchen', 'tiny', 'hole', 'easily', 'collect', 'dust', 'idea', 'clean', 'safely', 'overall', 'feel', 'disappointed', 'buy', 'go', 'google', 'product', 'instead', 'understand', 'indian', 'english', 'regional', 'language', 'name', 'well']",ve device 2023 honestly day ve felt disappointed purchase ongoing issues need attention poor voice recognition doesn t recognise words properly especially indian english reality ask telugu tamil songs doesn t understand play correct ones frequent disconnection issues months disconnects reset work time hasn t connected 10 days lack helpful suggestions alexa regular suggestions mobile app youtube better use right use songs reminders time weather maintenance issue echo kept kitchen tiny holes easily collect dust idea clean safely overall feel disappointed bought gone google product instead understands indian english regional language names better,ve device 2023 honestly day ve feel disappointed purchase ongoing issue need attention poor voice recognition doesn t recognise word properly especially indian english reality ask telugu tamil song doesn t understand play correct one frequent disconnection issue month disconnect reset work time hasn t connect 10 day lack helpful suggestion alexa regular suggestion mobile app youtube well use right use song reminder time weather maintenance issue echo keep kitchen tiny hole easily collect dust idea clean safely overall feel disappointed buy go google product instead understand indian english regional language name well,93
Sachin Singh,4.0 out of 5 stars,2 August 2025,Fabulous,BlueConfiguration: Echo Dot Only,Good Product bougt it for my sister. Looking to buy it again just waiting for price drop. Sound quality is best.,good product bougt it for my sister looking to buy it again just waiting for price drop sound quality is best,"['good', 'product', 'bougt', 'sister', 'looking', 'buy', 'waiting', 'price', 'drop', 'sound', 'quality', 'best']","['good', 'product', 'bougt', 'sister', 'look', 'buy', 'wait', 'price', 'drop', 'sound', 'quality', 'good']",good product bougt sister looking buy waiting price drop sound quality best,good product bougt sister look buy wait price drop sound quality good,12
Shantkumar,5.0 out of 5 stars,18 October 2025,Good sounds,BlackConfiguration: Echo Dot Only,Sound quality is good andVoice recognition is amazing,sound quality is good andvoice recognition is amazing,"['sound', 'quality', 'good', 'andvoice', 'recognition', 'amazing']","['sound', 'quality', 'good', 'andvoice', 'recognition', 'amazing']",sound quality good andvoice recognition amazing,sound quality good andvoice recognition amazing,6
Sumit,3.0 out of 5 stars,19 July 2025,It is not a bluetooth speaker,BlueConfiguration: Echo Dot Only,"Giving it 3 because i was searching for a bluetooth speaker and amazon showed as one of the best selling one. It is not a bluetooth speaker in traditional sense. U can pair it with bluetooth but the process is cumbersome and it does not have a battery and has to powered by cord for use which is not informed in product description. If you are not into voice assistant or dont use it very frequently, it is of no use. Moreover it can't be returned, it can only be replaced with same product, so if you don't like the experience u don't have the option for return. Basically you are stuck with it. For me it was waste of money though i admit I should have researched better. Kind of diappointed as it is amazon product and being a customer satisfaction oriented company I expected them to give option of return if one doesn't like the experience.",giving it 3 because i was searching for a bluetooth speaker and amazon showed as one of the best selling one it is not a bluetooth speaker in traditional sense u can pair it with bluetooth but the process is cumbersome and it does not have a battery and has to powered by cord for use which is not informed in product description if you are not into voice assistant or do not use it very frequently it is of no use moreover it can t be returned it can only be replaced with same product so if you don t like the experience u don t have the option for return basically you are stuck with it for me it was waste of money though i admit i should have researched better kind of diappointed as it is amazon product and being a customer satisfaction oriented company i expected them to give option of return if one doesn t like the experience,"['giving', 'searching', 'bluetooth', 'speaker', 'amazon', 'showed', 'best', 'selling', 'bluetooth', 'speaker', 'traditional', 'sense', 'u', 'pair', 'bluetooth', 'process', 'cumbersome', 'battery', 'powered', 'cord', 'use', 'informed', 'product', 'description', 'voice', 'assistant', 'use', 'frequently', 'use', 't', 'returned', 'replaced', 'product', 'don', 't', 'like', 'experience', 'u', 'don', 't', 'option', 'return', 'basically', 'stuck', 'waste', 'money', 'admit', 'researched', 'better', 'kind', 'diappointed', 'amazon', 'product', 'customer', 'satisfaction', 'oriented', 'company', 'expected', 'option', 'return', 'doesn', 't', 'like', 'experience']","['give', 'search', 'bluetooth', 'speaker', 'amazon', 'show', 'good', 'selling', 'bluetooth', 'speaker', 'traditional', 'sense', 'u', 'pair', 'bluetooth', 'process', 'cumbersome', 'battery', 'power', 'cord', 'use', 'inform', 'product', 'description', 'voice', 'assistant', 'use', 'frequently', 'use', 't', 'return', 'replace', 'product', 'don', 't', 'like', 'experience', 'u', 'don', 't', 'option', 'return', 'basically', 'stick', 'waste', 'money', 'admit', 'research', 'well', 'kind', 'diappointe', 'amazon', 'product', 'customer', 'satisfaction', 'orient', 'company', 'expect', 'option', 'return', 'doesn', 't', 'like', 'experience']",giving searching bluetooth speaker amazon showed best selling bluetooth speaker traditional sense u pair bluetooth process cumbersome battery powered cord use informed product description voice assistant use frequently use t returned replaced product don t like experience u don t option return basically stuck waste money admit researched better kind diappointed amazon product customer satisfaction oriented company expected option return doesn t like experience,give search bluetooth speaker amazon show good selling bluetooth speaker traditional sense u pair bluetooth process cumbersome battery power cord use inform product description voice assistant use frequently use t return replace product don t like experience u don t option return basically stick waste money admit research well kind diappointe amazon product customer satisfaction orient company expect option return doesn t like experience,64
rana pratap,5.0 out of 5 stars,9 October 2025,Jabardast,BlueConfiguration: Echo Dot Only,"I am writing my review after using it for 1 year, it is a very wonderful and amazing product.",i am writing my review after using it for 1 year it is a very wonderful and amazing product,"['writing', 'review', 'year', 'wonderful', 'amazing', 'product']","['write', 'review', 'year', 'wonderful', 'amazing', 'product']",writing review year wonderful amazing product,write review year wonderful amazing product,6
Amazon Customer,5.0 out of 5 stars,16 October 2025,Must have,BlueConfiguration: Echo Dot Only,Awesome product.Loved it.Highly recommended . Sound is too good.Thanks,awesome product loved it highly recommended sound is too good thanks,"['awesome', 'product', 'loved', 'highly', 'recommended', 'sound', 'good', 'thanks']","['awesome', 'product', 'love', 'highly', 'recommend', 'sound', 'good', 'thank']",awesome product loved highly recommended sound good thanks,awesome product love highly recommend sound good thank,8
3 glass is broken and not a genuine product,5.0 out of 5 stars,18 October 2025,Best,WhiteConfiguration: Echo Dot Only,Best product for every family,best product for every family,"['best', 'product', 'family']","['good', 'product', 'family']",best product family,good product family,3
Narinder Kaur,5.0 out of 5 stars,12 October 2025,I love eco dot,BlackConfiguration: Echo Dot Only,"I had third generation before my nephew broke it so I bought Alexa fourth generation echo that one was such a disappointment and had to return it now I got fifth generation echo dot and I love it. It’s very light. I find it smaller a little smaller and a light lighter than the third generation, which is great because I travel a lot, and I carry this around with me. Sound  Quality is also very good a lot better than fourth generation echo",i had third generation before my nephew broke it so i bought alexa fourth generation echo that one was such a disappointment and had to return it now i got fifth generation echo dot and i love it it s very light i find it smaller a little smaller and a light lighter than the third generation which is great because i travel a lot and i carry this around with me sound quality is also very good a lot better than fourth generation echo,"['generation', 'nephew', 'broke', 'bought', 'alexa', 'fourth', 'generation', 'echo', 'disappointment', 'return', 'got', 'fifth', 'generation', 'echo', 'dot', 'love', 's', 'light', 'find', 'smaller', 'little', 'smaller', 'light', 'lighter', 'generation', 'great', 'travel', 'lot', 'carry', 'sound', 'quality', 'good', 'lot', 'better', 'fourth', 'generation', 'echo']","['generation', 'nephew', 'break', 'buy', 'alexa', 'fourth', 'generation', 'echo', 'disappointment', 'return', 'get', 'fifth', 'generation', 'echo', 'dot', 'love', 's', 'light', 'find', 'small', 'little', 'small', 'light', 'light', 'generation', 'great', 'travel', 'lot', 'carry', 'sound', 'quality', 'good', 'lot', 'well', 'fourth', 'generation', 'echo']",generation nephew broke bought alexa fourth generation echo disappointment return got fifth generation echo dot love s light find smaller little smaller light lighter generation great travel lot carry sound quality good lot better fourth generation echo,generation nephew break buy alexa fourth generation echo disappointment return get fifth generation echo dot love s light find small little small light light generation great travel lot carry sound quality good lot well fourth generation echo,37
Madhav,5.0 out of 5 stars,11 October 2025,Good product,BlueConfiguration: Echo Dot Only,First time using an echo dot and I’m enjoying it,first time using an echo dot and i m enjoying it,"['time', 'echo', 'dot', 'm', 'enjoying']","['time', 'echo', 'dot', 'm', 'enjoy']",time echo dot m enjoying,time echo dot m enjoy,5
Dr. Padmavathi K,5.0 out of 5 stars,3 October 2025,Nil,BlueConfiguration: Echo Dot Only,It doesnt play songs from you tube. But supports spotify. It doesnt identify language while playing songs. It can identify the singer,it does not play songs from you tube but supports spotify it does not identify language while playing songs it can identify the singer,"['play', 'songs', 'tube', 'supports', 'spotify', 'identify', 'language', 'playing', 'songs', 'identify', 'singer']","['play', 'song', 'tube', 'support', 'spotify', 'identify', 'language', 'play', 'song', 'identify', 'singer']",play songs tube supports spotify identify language playing songs identify singer,play song tube support spotify identify language play song identify singer,11
Priyal Kumar,2.0 out of 5 stars,20 February 2025,Better buy Google Home Mini,BlueConfiguration: Echo Dot Only,"The ultrasonic motion detector is unusable, it works like 10% of the time only. Google it up guys, everyone is complaining about it.Sound recognition is better in English than in Hindi. You can only talk to Alexa in simple sentences. Can't process multiple sentences (Alexa, turn off fan and turn on the bulb) or complex queries. Sound quality is impressive but to play music, you must have Amazon Prime membership or Spotify Premium. It also can't tell you when a place is open or close by looking at Google Maps, only Google Nest speakers have that functionality. Not just its use cases are very less, half of the time, it misinterprets what you are saying, so you have to reframe your command it different ways. For the whole day, if you have to keep on saying ""Alexa, ... Alexa ..."", it feels awkward; Your family will look at you as if you are an idiot.In the Alexa app, I can't save my house address, it shows error?? Also, the app is slow, for each menu you click, it has to fetch data from the cloud.When I tell it, ""Turn on the geyser for 10 minutes"", it instead, turns on my geyser after 10 minutes. When I tell it ""For 10 minutes, turn on my geyser."". That's when it understands my query and does what I want. So, you have to remember what combination works and what doesn't. If you say ""pankha chala do"" instead of ""fan chala do"", then it will say that ""No device named Pankha is found"". So, you have to remember the names of the devices. Like, I have multiple tubelights on smart home n/w. But I've to save their name differently, one is named ""tubelight"", other is named ""bulb"".It rained yesterday, but when I asked Alexa if it rained yesterday, it said ""No ..."". So you can't believe it to know the weather as well.When I ask Alexa about which one of my Amazon Delivery is due today, it instead reads all of my delivery.In plain words, it mostly sucks.Only useful query are these simple sentences: ""Alexa, turn off entryway light"", ""Alexa, turn on the socket"", etc.Google Home Mini is cheaper at Rs.4.5kIts Assistant AI is better. And it can tell you when a shop is open or where a particular food item is available in which restaurant. Also, if there is traffic or not.",the ultrasonic motion detector is unusable it works like 10 of the time only google it up guys everyone is complaining about it sound recognition is better in english than in hindi you can only talk to alexa in simple sentences can t process multiple sentences alexa turn off fan and turn on the bulb or complex queries sound quality is impressive but to play music you must have amazon prime membership or spotify premium it also can t tell you when a place is open or close by looking at google maps only google nest speakers have that functionality not just its use cases are very less half of the time it misinterprets what you are saying so you have to reframe your command it different ways for the whole day if you have to keep on saying alexa alexa it feels awkward your family will look at you as if you are an idiot in the alexa app i can t save my house address it shows error also the app is slow for each menu you click it has to fetch data from the cloud when i tell it turn on the geyser for 10 minutes it instead turns on my geyser after 10 minutes when i tell it for 10 minutes turn on my geyser that s when it understands my query and does what i want so you have to remember what combination works and what doesn t if you say pankha chala do instead of fan chala do then it will say that no device named pankha is found so you have to remember the names of the devices like i have multiple tubelights on smart home n w but i ve to save their name differently one is named tubelight other is named bulb it rained yesterday but when i asked alexa if it rained yesterday it said no so you can t believe it to know the weather as well when i ask alexa about which one of my amazon delivery is due today it instead reads all of my delivery in plain words it mostly sucks only useful query are these simple sentences alexa turn off entryway light alexa turn on the socket etc google home mini is cheaper at rs 4 5kits assistant ai is better and it can notell you when a shop is open or where a particular food item is available in which restaurant also if there is traffic or not,"['ultrasonic', 'motion', 'detector', 'unusable', 'works', 'like', '10', 'time', 'google', 'guys', 'complaining', 'sound', 'recognition', 'better', 'english', 'hindi', 'talk', 'alexa', 'simple', 'sentences', 't', 'process', 'multiple', 'sentences', 'alexa', 'turn', 'fan', 'turn', 'bulb', 'complex', 'queries', 'sound', 'quality', 'impressive', 'play', 'music', 'amazon', 'prime', 'membership', 'spotify', 'premium', 't', 'tell', 'place', 'open', 'close', 'looking', 'google', 'maps', 'google', 'nest', 'speakers', 'functionality', 'use', 'cases', 'half', 'time', 'misinterprets', 'saying', 'reframe', 'command', 'different', 'ways', 'day', 'saying', 'alexa', 'alexa', 'feels', 'awkward', 'family', 'look', 'idiot', 'alexa', 'app', 't', 'save', 'house', 'address', 'shows', 'error', 'app', 'slow', 'menu', 'click', 'fetch', 'data', 'cloud', 'tell', 'turn', 'geyser', '10', 'minutes', 'instead', 'turns', 'geyser', '10', 'minutes', 'tell', '10', 'minutes', 'turn', 'geyser', 's', 'understands', 'query', 'want', 'remember', 'combination', 'works', 'doesn', 't', 'pankha', 'chala', 'instead', 'fan', 'chala', 'device', 'named', 'pankha', 'found', 'remember', 'names', 'devices', 'like', 'multiple', 'tubelights', 'smart', 'home', 'n', 'w', 've', 'save', 'differently', 'named', 'tubelight', 'named', 'bulb', 'rained', 'yesterday', 'asked', 'alexa', 'rained', 'yesterday', 'said', 't', 'believe', 'know', 'weather', 'ask', 'alexa', 'amazon', 'delivery', 'today', 'instead', 'reads', 'delivery', 'plain', 'words', 'sucks', 'useful', 'query', 'simple', 'sentences', 'alexa', 'turn', 'entryway', 'light', 'alexa', 'turn', 'socket', 'etc', 'google', 'home', 'mini', 'cheaper', 'rs', 'assistant', 'ai', 'better', 'notell', 'shop', 'open', 'particular', 'food', 'item', 'available', 'restaurant', 'traffic']","['ultrasonic', 'motion', 'detector', 'unusable', 'work', 'like', '10', 'time', 'google', 'guy', 'complain', 'sound', 'recognition', 'well', 'english', 'hindi', 'talk', 'alexa', 'simple', 'sentence', 't', 'process', 'multiple', 'sentence', 'alexa', 'turn', 'fan', 'turn', 'bulb', 'complex', 'query', 'sound', 'quality', 'impressive', 'play', 'music', 'amazon', 'prime', 'membership', 'spotify', 'premium', 't', 'tell', 'place', 'open', 'close', 'look', 'google', 'maps', 'google', 'nest', 'speaker', 'functionality', 'use', 'case', 'half', 'time', 'misinterpret', 'say', 'reframe', 'command', 'different', 'way', 'day', 'say', 'alexa', 'alexa', 'feel', 'awkward', 'family', 'look', 'idiot', 'alexa', 'app', 't', 'save', 'house', 'address', 'show', 'error', 'app', 'slow', 'menu', 'click', 'fetch', 'datum', 'cloud', 'tell', 'turn', 'geyser', '10', 'minute', 'instead', 'turn', 'geyser', '10', 'minute', 'tell', '10', 'minute', 'turn', 'geyser', 's', 'understand', 'query', 'want', 'remember', 'combination', 'work', 'doesn', 't', 'pankha', 'chala', 'instead', 'fan', 'chala', 'device', 'name', 'pankha', 'find', 'remember', 'name', 'device', 'like', 'multiple', 'tubelight', 'smart', 'home', 'n', 'w', 've', 'save', 'differently', 'name', 'tubelight', 'name', 'bulb', 'rain', 'yesterday', 'ask', 'alexa', 'rain', 'yesterday', 'say', 't', 'believe', 'know', 'weather', 'ask', 'alexa', 'amazon', 'delivery', 'today', 'instead', 'read', 'delivery', 'plain', 'word', 'suck', 'useful', 'query', 'simple', 'sentence', 'alexa', 'turn', 'entryway', 'light', 'alexa', 'turn', 'socket', 'etc', 'google', 'home', 'mini', 'cheap', 'rs', 'assistant', 'ai', 'well', 'notell', 'shop', 'open', 'particular', 'food', 'item', 'available', 'restaurant', 'traffic']",ultrasonic motion detector unusable works like 10 time google guys complaining sound recognition better english hindi talk alexa simple sentences t process multiple sentences alexa turn fan turn bulb complex queries sound quality impressive play music amazon prime membership spotify premium t tell place open close looking google maps google nest speakers functionality use cases half time misinterprets saying reframe command different ways day saying alexa alexa feels awkward family look idiot alexa app t save house address shows error app slow menu click fetch data cloud tell turn geyser 10 minutes instead turns geyser 10 minutes tell 10 minutes turn geyser s understands query want remember combination works doesn t pankha chala instead fan chala device named pankha found remember names devices like multiple tubelights smart home n w ve save differently named tubelight named bulb rained yesterday asked alexa rained yesterday said t believe know weather ask alexa amazon delivery today instead reads delivery plain words sucks useful query simple sentences alexa turn entryway light alexa turn socket etc google home mini cheaper rs assistant ai better notell shop open particular food item available restaurant traffic,ultrasonic motion detector unusable work like 10 time google guy complain sound recognition well english hindi talk alexa simple sentence t process multiple sentence alexa turn fan turn bulb complex query sound quality impressive play music amazon prime membership spotify premium t tell place open close look google maps google nest speaker functionality use case half time misinterpret say reframe command different way day say alexa alexa feel awkward family look idiot alexa app t save house address show error app slow menu click fetch datum cloud tell turn geyser 10 minute instead turn geyser 10 minute tell 10 minute turn geyser s understand query want remember combination work doesn t pankha chala instead fan chala device name pankha find remember name device like multiple tubelight smart home n w ve save differently name tubelight name bulb rain yesterday ask alexa rain yesterday say t believe know weather ask alexa amazon delivery today instead read delivery plain word suck useful query simple sentence alexa turn entryway light alexa turn socket etc google home mini cheap rs assistant ai well notell shop open particular food item available restaurant traffic,188
ASHOK KUMAR,5.0 out of 5 stars,10 October 2025,Very good product,BlueConfiguration: Echo Dot Only,Very nice productWatch saat me hoti to aur bhi acha hota.,very nice productwatch saat me hoti to aur bhi good hota,"['nice', 'productwatch', 'saat', 'hoti', 'aur', 'bhi', 'good', 'hota']","['nice', 'productwatch', 'saat', 'hoti', 'aur', 'bhi', 'good', 'hota']",nice productwatch saat hoti aur bhi good hota,nice productwatch saat hoti aur bhi good hota,8
